{
  "$schema": "./schemas/study-plans.schema.json",
  "schemaVersion": 1,
  "defaults": {
    "modeMinutes": {
      "learn": 30,
      "interactive": 10,
      "practice": 15,
      "interview": 10,
      "flashcards": 5,
      "revision": 60
    }
  },
  "stages": {
    "apt-quant": {
      "title": "Quantitative aptitude",
      "include": [
        {
          "subject": "aptitude",
          "modules": [
            "quantitative-aptitude"
          ]
        }
      ]
    },
    "apt-logical": {
      "title": "Logical reasoning",
      "include": [
        {
          "subject": "aptitude",
          "modules": [
            "logical-reasoning"
          ]
        }
      ]
    },
    "apt-verbal": {
      "title": "Verbal ability",
      "include": [
        {
          "subject": "aptitude",
          "modules": [
            "verbal-ability"
          ]
        }
      ]
    },
    "dsa-foundations": {
      "title": "DSA foundations",
      "include": [
        {
          "subject": "dsa",
          "modules": [
            "fundamentals",
            "problem-solving"
          ]
        }
      ]
    },
    "dsa-structures": {
      "title": "Data structures",
      "include": [
        {
          "subject": "dsa",
          "modules": [
            "data-structures"
          ]
        }
      ]
    },
    "dsa-algorithms": {
      "title": "Algorithms",
      "include": [
        {
          "subject": "dsa",
          "modules": [
            "algorithms"
          ]
        }
      ]
    },
    "dsa-patterns": {
      "title": "Problem-solving patterns",
      "include": [
        {
          "subject": "dsa",
          "modules": [
            "patterns"
          ]
        }
      ]
    },
    "dsa-interview": {
      "title": "DSA interview",
      "include": [
        {
          "subject": "dsa",
          "modules": [
            "interview"
          ]
        }
      ]
    },
    "oop-core": {
      "title": "OOP and Java fundamentals",
      "include": [
        {
          "subject": "oop",
          "modules": [
            "fundamentals",
            "pillars",
            "relationships",
            "java-oop"
          ]
        }
      ]
    },
    "oop-design": {
      "title": "Object-oriented design",
      "include": [
        {
          "subject": "oop",
          "modules": [
            "applied-oop",
            "design-principles",
            "object-oriented-design",
            "code-quality"
          ]
        }
      ]
    },
    "oop-patterns": {
      "title": "Design patterns and problems",
      "include": [
        {
          "subject": "oop",
          "modules": [
            "design-patterns",
            "design-problems"
          ]
        }
      ]
    },
    "oop-interview": {
      "title": "OOP interview",
      "include": [
        {
          "subject": "oop",
          "modules": [
            "interview"
          ]
        }
      ]
    },
    "sql-core": {
      "title": "SQL fundamentals",
      "include": [
        {
          "subject": "dbms-postgresql",
          "modules": [
            "dbms-fundamentals",
            "relational-model",
            "sql-fundamentals",
            "null-and-conditional-logic",
            "joins",
            "subqueries",
            "aggregation-and-grouping",
            "set-operations"
          ]
        }
      ]
    },
    "sql-advanced": {
      "title": "Advanced SQL and PostgreSQL",
      "include": [
        {
          "subject": "dbms-postgresql",
          "modules": [
            "ctes",
            "window-functions",
            "postgresql-data-types",
            "postgresql-features",
            "views-and-materialized-views",
            "temp-tables",
            "functions-procedures-triggers",
            "sql-problem-solving"
          ]
        }
      ]
    },
    "db-design": {
      "title": "Database design",
      "include": [
        {
          "subject": "dbms-postgresql",
          "modules": [
            "database-design",
            "normalization"
          ]
        }
      ]
    },
    "db-internals": {
      "title": "Transactions, indexing and performance",
      "include": [
        {
          "subject": "dbms-postgresql",
          "modules": [
            "transactions",
            "concurrency-and-mvcc",
            "indexing",
            "query-optimization",
            "security-and-permissions",
            "partitioning",
            "debugging"
          ]
        }
      ]
    },
    "db-interview": {
      "title": "DBMS interview",
      "include": [
        {
          "subject": "dbms-postgresql",
          "modules": [
            "interview"
          ]
        }
      ]
    },
    "os-core": {
      "title": "Operating systems",
      "include": [
        {
          "subject": "operating-systems"
        }
      ]
    },
    "cn-core": {
      "title": "Networking foundations",
      "include": [
        {
          "subject": "computer-networks",
          "modules": [
            "network-fundamentals",
            "network-devices",
            "osi-model",
            "tcp-ip-model",
            "physical-and-data-link",
            "arp-and-local-delivery",
            "ip-addressing",
            "subnetting",
            "routing"
          ]
        }
      ]
    },
    "cn-protocols": {
      "title": "Transport and application protocols",
      "include": [
        {
          "subject": "computer-networks",
          "modules": [
            "transport-layer",
            "flow-and-congestion-control",
            "application-layer",
            "http",
            "https-and-tls",
            "dns",
            "dhcp",
            "nat"
          ]
        }
      ]
    },
    "cn-operations": {
      "title": "Network security, performance and troubleshooting",
      "include": [
        {
          "subject": "computer-networks",
          "modules": [
            "network-security",
            "performance",
            "troubleshooting",
            "end-to-end-flows"
          ]
        }
      ]
    },
    "cn-interview": {
      "title": "Networks interview",
      "include": [
        {
          "subject": "computer-networks",
          "modules": [
            "interview"
          ]
        }
      ]
    },
    "linux-core": {
      "title": "Linux essentials",
      "include": [
        {
          "subject": "linux",
          "modules": [
            "linux-fundamentals",
            "filesystem",
            "basic-commands",
            "redirection-and-pipes",
            "text-processing",
            "permissions",
            "users-and-groups",
            "processes"
          ]
        }
      ]
    },
    "linux-scripting": {
      "title": "Shell scripting",
      "include": [
        {
          "subject": "linux",
          "modules": [
            "shell-and-bash",
            "bash-scripting",
            "find-sed-awk"
          ]
        }
      ]
    },
    "linux-admin": {
      "title": "Linux administration",
      "include": [
        {
          "subject": "linux",
          "modules": [
            "archives-and-packages",
            "networking",
            "storage",
            "system-management",
            "remote-access",
            "troubleshooting"
          ]
        }
      ]
    },
    "linux-interview": {
      "title": "Linux interview",
      "include": [
        {
          "subject": "linux",
          "modules": [
            "interview"
          ]
        }
      ]
    },
    "sb-core": {
      "title": "Spring and Spring Boot core",
      "include": [
        {
          "subject": "spring-boot",
          "modules": [
            "fundamentals",
            "dependency-injection",
            "spring-boot-core"
          ]
        }
      ]
    },
    "sb-web": {
      "title": "Web layer and REST APIs",
      "include": [
        {
          "subject": "spring-boot",
          "modules": [
            "spring-mvc",
            "rest",
            "validation",
            "exception-handling"
          ]
        }
      ]
    },
    "sb-data": {
      "title": "Data access and transactions",
      "include": [
        {
          "subject": "spring-boot",
          "modules": [
            "jpa-hibernate",
            "transactions"
          ]
        }
      ]
    },
    "sb-security": {
      "title": "Spring Security",
      "include": [
        {
          "subject": "spring-boot",
          "modules": [
            "security",
            "web-security"
          ]
        }
      ]
    },
    "sb-production": {
      "title": "Production, advanced topics and debugging",
      "include": [
        {
          "subject": "spring-boot",
          "modules": [
            "production",
            "advanced",
            "debugging"
          ]
        }
      ]
    },
    "sb-interview": {
      "title": "Spring Boot interview",
      "include": [
        {
          "subject": "spring-boot",
          "modules": [
            "interview"
          ]
        }
      ]
    },
    "sd-foundations": {
      "title": "System design foundations",
      "include": [
        {
          "subject": "system-design",
          "modules": [
            "foundations",
            "communication"
          ]
        }
      ]
    },
    "sd-data": {
      "title": "Data, storage and caching",
      "include": [
        {
          "subject": "system-design",
          "modules": [
            "data-and-storage",
            "caching"
          ]
        }
      ]
    },
    "sd-scale": {
      "title": "Scaling, consistency and reliability",
      "include": [
        {
          "subject": "system-design",
          "modules": [
            "scaling-and-distribution",
            "consistency-and-coordination",
            "reliability",
            "messaging",
            "observability"
          ]
        }
      ]
    },
    "sd-cases": {